[
  {
    "id": "c001",
    "start": 23.0,
    "end": 24.5,
    "text": "You're a jerk, Thom.",
    "spans": [
      {
        "id": "c001-s1",
        "start": 9,
        "end": 13,
        "surface": "jerk",
        "lemma": "jerk",
        "pos": "noun",
        "level": "B2",
        "kind": "word"
      }
    ]
  },
  {
    "id": "c002",
    "start": 25.0,
    "end": 27.0,
    "text": "Look Celia, we have to follow our passions;",
    "spans": [
      {
        "id": "c002-s1",
        "start": 34,
        "end": 42,
        "surface": "passions",
        "lemma": "passion",
        "pos": "noun",
        "level": "B2",
        "kind": "word"
      }
    ]
  },
  {
    "id": "c003",
    "start": 27.0,
    "end": 30.5,
    "text": "...you have your robotics, and I just want to be awesome in space.",
    "spans": []
  },
  {
    "id": "c004",
    "start": 30.8,
    "end": 34.0,
    "text": "Why don't you just admit that you're freaked out by my robot hand?",
    "spans": [
      {
        "id": "c004-s1",
        "start": 37,
        "end": 48,
        "surface": "freaked out",
        "lemma": "freak out",
        "pos": "phrasal verb",
        "level": "B2",
        "kind": "phrasal"
      }
    ]
  },
  {
    "id": "c005",
    "start": 34.5,
    "end": 36.0,
    "text": "I'm not freaked out by- it's...",
    "spans": []
  },
  {
    "id": "c006",
    "start": 37.0,
    "end": 38.0,
    "text": "...alright! Fine!",
    "spans": []
  },
  {
    "id": "c007",
    "start": 38.0,
    "end": 41.0,
    "text": "I'm freaked out! I have nightmares that I'm being chased...",
    "spans": [
      {
        "id": "c007-s1",
        "start": 24,
        "end": 34,
        "surface": "nightmares",
        "lemma": "nightmare",
        "pos": "noun",
        "level": "B2",
        "kind": "word"
      }
    ]
  },
  {
    "id": "c008",
    "start": 41.0,
    "end": 42.0,
    "text": "...by these giant robotic claws of death...",
    "spans": [
      {
        "id": "c008-s1",
        "start": 26,
        "end": 31,
        "surface": "claws",
        "lemma": "claw",
        "pos": "noun",
        "level": "C1",
        "kind": "word"
      }
    ]
  },
  {
    "id": "c009",
    "start": 42.2,
    "end": 45.0,
    "text": "\"Fourty years later\" Whatever, Thom. We're done.",
    "spans": []
  },
  {
    "id": "c010",
    "start": 50.0,
    "end": 53.5,
    "text": "Robot's memory synced and locked!",
    "spans": [
      {
        "id": "c010-s1",
        "start": 15,
        "end": 21,
        "surface": "synced",
        "lemma": "sync",
        "pos": "verb",
        "level": "C1",
        "kind": "word"
      }
    ]
  },
  {
    "id": "c011",
    "start": 61.0,
    "end": 63.0,
    "text": "This is pretty freaky.",
    "spans": []
  },
  {
    "id": "c012",
    "start": 117.0,
    "end": 119.0,
    "text": "Shouldn't you be down there?",
    "spans": []
  },
  {
    "id": "c013",
    "start": 131.0,
    "end": 133.0,
    "text": "I heard you guys talking last night.",
    "spans": []
  },
  {
    "id": "c014",
    "start": 136.0,
    "end": 138.0,
    "text": "It's not my fault, you know.",
    "spans": []
  },
  {
    "id": "c015",
    "start": 191.0,
    "end": 192.0,
    "text": "Are you ready?",
    "spans": []
  },
  {
    "id": "c016",
    "start": 193.0,
    "end": 195.0,
    "text": "Of course you're ready, you're a rockstar.",
    "spans": [
      {
        "id": "c016-s1",
        "start": 33,
        "end": 41,
        "surface": "rockstar",
        "lemma": "rock star",
        "pos": "noun",
        "level": "C1",
        "kind": "word"
      }
    ]
  },
  {
    "id": "c017",
    "start": 197.0,
    "end": 198.0,
    "text": "How's it looking, Barley?",
    "spans": []
  },
  {
    "id": "c018",
    "start": 199.0,
    "end": 201.0,
    "text": "We should have about ten minutes...",
    "spans": []
  },
  {
    "id": "c019",
    "start": 201.5,
    "end": 203.0,
    "text": "Well that's perfect.",
    "spans": []
  },
  {
    "id": "c020",
    "start": 203.5,
    "end": 206.5,
    "text": "We're on in one! All systems go! Yeah you, go!",
    "spans": [
      {
        "id": "c020-s1",
        "start": 17,
        "end": 31,
        "surface": "All systems go",
        "lemma": "all systems go",
        "pos": "idiom",
        "level": "C1",
        "kind": "idiom"
      }
    ]
  },
  {
    "id": "c021",
    "start": 208.0,
    "end": 212.0,
    "text": "Go! Move your asses! Go go go!",
    "spans": []
  },
  {
    "id": "c022",
    "start": 213.0,
    "end": 217.0,
    "text": "I love it! Come on, go!",
    "spans": []
  },
  {
    "id": "c023",
    "start": 223.0,
    "end": 224.0,
    "text": "That's nice.",
    "spans": []
  },
  {
    "id": "c024",
    "start": 224.5,
    "end": 225.7,
    "text": "Nothing to worry about.",
    "spans": []
  },
  {
    "id": "c025",
    "start": 226.0,
    "end": 227.0,
    "text": "Thom.",
    "spans": []
  },
  {
    "id": "c026",
    "start": 231.0,
    "end": 233.0,
    "text": "There she is.",
    "spans": []
  },
  {
    "id": "c027",
    "start": 233.5,
    "end": 234.5,
    "text": "Now.",
    "spans": []
  },
  {
    "id": "c028",
    "start": 235.0,
    "end": 236.0,
    "text": "You love her.",
    "spans": []
  },
  {
    "id": "c029",
    "start": 237.0,
    "end": 238.5,
    "text": "She is your passion!",
    "spans": []
  },
  {
    "id": "c030",
    "start": 240.0,
    "end": 241.0,
    "text": "Be tender to her.",
    "spans": [
      {
        "id": "c030-s1",
        "start": 3,
        "end": 9,
        "surface": "tender",
        "lemma": "tender",
        "pos": "adjective",
        "level": "C1",
        "kind": "word"
      }
    ]
  },
  {
    "id": "c031",
    "start": 241.5,
    "end": 244.5,
    "text": "Be honest! Eh- be tender.",
    "spans": []
  },
  {
    "id": "c032",
    "start": 245.0,
    "end": 248.0,
    "text": "Remind her what love is.",
    "spans": []
  },
  {
    "id": "c033",
    "start": 292.0,
    "end": 295.0,
    "text": "...and, action!",
    "spans": []
  },
  {
    "id": "c034",
    "start": 296.5,
    "end": 298.0,
    "text": "Memory overwrite in progress!",
    "spans": []
  },
  {
    "id": "c035",
    "start": 299.0,
    "end": 301.0,
    "text": "You're a jerk, Thom!",
    "spans": []
  },
  {
    "id": "c036",
    "start": 302.5,
    "end": 305.0,
    "text": "Ohp- Sorry! Sorry.",
    "spans": []
  },
  {
    "id": "c037",
    "start": 316.0,
    "end": 317.0,
    "text": "Look Celia.",
    "spans": []
  },
  {
    "id": "c038",
    "start": 318.0,
    "end": 320.0,
    "text": "We have to follow our passions.",
    "spans": []
  },
  {
    "id": "c039",
    "start": 321.0,
    "end": 323.0,
    "text": "You have your robotics...",
    "spans": []
  },
  {
    "id": "c040",
    "start": 325.0,
    "end": 328.0,
    "text": "...and I just want to be awesome in space.",
    "spans": []
  },
  {
    "id": "c041",
    "start": 339.0,
    "end": 341.0,
    "text": "Okay, they're coming. Two minutes left!",
    "spans": []
  },
  {
    "id": "c042",
    "start": 343.0,
    "end": 344.0,
    "text": "Speed it up, Thom!",
    "spans": [
      {
        "id": "c042-s1",
        "start": 0,
        "end": 11,
        "surface": "Speed it up",
        "lemma": "speed up",
        "pos": "phrasal verb",
        "level": "B1",
        "kind": "phrasal"
      }
    ]
  },
  {
    "id": "c043",
    "start": 345.0,
    "end": 346.0,
    "text": "Vivacissimo!",
    "spans": []
  },
  {
    "id": "c044",
    "start": 347.0,
    "end": 350.0,
    "text": "Why don't you just admit that you're freaked out by my robot hand?",
    "spans": []
  },
  {
    "id": "c045",
    "start": 356.0,
    "end": 359.0,
    "text": "Listen Celia, I was young...",
    "spans": []
  },
  {
    "id": "c046",
    "start": 359.5,
    "end": 361.0,
    "text": "...and a dick.",
    "spans": []
  },
  {
    "id": "c047",
    "start": 361.0,
    "end": 363.0,
    "text": "But that's no reason to destroy the world.",
    "spans": [
      {
        "id": "c047-s1",
        "start": 24,
        "end": 31,
        "surface": "destroy",
        "lemma": "destroy",
        "pos": "verb",
        "level": "B2",
        "kind": "word"
      }
    ]
  },
  {
    "id": "c048",
    "start": 365.0,
    "end": 366.0,
    "text": "Why does he do this?",
    "spans": []
  },
  {
    "id": "c049",
    "start": 366.5,
    "end": 368.5,
    "text": "We already tried that one!",
    "spans": []
  },
  {
    "id": "c050",
    "start": 371.5,
    "end": 372.5,
    "text": "Abort!",
    "spans": [
      {
        "id": "c050-s1",
        "start": 0,
        "end": 5,
        "surface": "Abort",
        "lemma": "abort",
        "pos": "verb",
        "level": "C1",
        "kind": "word"
      }
    ]
  },
  {
    "id": "c051",
    "start": 373.0,
    "end": 374.0,
    "text": "Cut!",
    "spans": []
  },
  {
    "id": "c052",
    "start": 374.0,
    "end": 375.0,
    "text": "Whoaaa!",
    "spans": []
  },
  {
    "id": "c053",
    "start": 379.0,
    "end": 380.0,
    "text": "Whoaaa!",
    "spans": []
  },
  {
    "id": "c054",
    "start": 381.0,
    "end": 383.0,
    "text": "Nooooo!",
    "spans": []
  },
  {
    "id": "c055",
    "start": 383.0,
    "end": 385.0,
    "text": "You broke my heart.",
    "spans": [
      {
        "id": "c055-s1",
        "start": 4,
        "end": 18,
        "surface": "broke my heart",
        "lemma": "break someone's heart",
        "pos": "idiom",
        "level": "B2",
        "kind": "idiom"
      }
    ]
  },
  {
    "id": "c056",
    "start": 386.0,
    "end": 387.0,
    "text": "I know.",
    "spans": []
  },
  {
    "id": "c057",
    "start": 387.0,
    "end": 389.0,
    "text": "You forgot me on earth.",
    "spans": []
  },
  {
    "id": "c058",
    "start": 389.0,
    "end": 390.0,
    "text": "I know.",
    "spans": []
  },
  {
    "id": "c059",
    "start": 390.5,
    "end": 393.0,